"0","하반기 지자체 49곳 금고 운영권 두고' 협력사업비' 경쟁 반복되나","한국전력 등 전력당국에 따르면 오는 25일(마지막 주)부터 다음달 14일(둘째 주)까지 최소 250만 정도의 전력공급능력이 감소될 것으로 예고됐다.","EC_M04_011934"
"0","外人, 지난달 '깜짝 주식 쇼핑'…10월은 다시 '셀코리아'?","KAIST 교수협의회가 서남표 총장의 용퇴를 촉구하는 세번째 메일을 소속 교수들에게 전달하며 진정 국면에 들어선 내홍 사태에 불씨를 다시 살리고 있다.","EC_M04_009251"
"0","울다가 웃다가… 도안지구 결말은?","국내 주요 시중은행들은 사내 여성인재 육성, 여성 리더 발굴을 위해 다양한 프로그램을 운영하고 있으며 여성인재 양성 프로그램은 공통적으로 여성 임직원의 역량 강화 리더십 고취 멘토링 등의 분야에서 교육을 진행하고 있다.","EC_M02_003682"
"0","신세계푸드, '프리미엄 아파트 식음 서비스' 전격 시행","신세계푸드는 이달부터 '서초 래미안 리더스원' 단지 내 커뮤니티 식음시설의 운영을 시작했다고 10일 밝혔으며 신세계푸드는 이달부터 '서초 래미안 리더스원' 단지 내 커뮤니티 식음시설의 운영을 시작했다고 10일 밝혔다.","EC_M02_160698"
"0","HDC랩스 신사옥 이전, '디지털 전환' 본격화","삼성증권 해외주식 매매를 처음하는 고객을 대상으로 최대 100달러를 지원하는 이벤트를 29일까지 진행한다고 밝혔으며 이번 이벤트는 2015년 1월 1일부터 2021년 9월 30일까지 해외주식 거래가 없었던 고객이 참여할 수 있다.","EC_M05_019267"
"0","단독·다가구, 저가 임대주택 거주자, 월세 선호 이유는?","지난 2년간 단독·다가구 거주자와 저가 임대주택에서 월세 비중이 크게 증가한 것으로 나타나며 월세 비중이 크게 증가한 것으로 나타나며 월세 비중이 크게 증가한 것으로 나타났다.","EC_M05_160412"
"0","대전지방국토관리청, ‘이것’ 적발돼… 강화 필요성 제기","대전지방국토관리청의 관내현장에서 다수의 하도급대금 부당지급사례가 적발돼 관리감독을 강화해야 한다는 지적이 제기되었다.","EC_M04_163163"
"0","랜섬웨어 예방부터 피해지원까지…에스원의 뉴 솔루션","국회에서는방송통신위원회 더불어민주당 유승희 국회의원(성북갑)은 “인구 150만명이 사는 대전시에 중저준위 방폐물 저장량이 전국 2위”라며 “방폐물에 대한 관리감독이 요구된다”고 13일 밝혔다.","EC_M04_017156"
"0","독일 라인란트 팔츠 주립 필하모니 공연 한국에서 원격 중계로 즐긴다. 어떻게?","마젠타컴퍼니는 오는 16일 독일 라인란트 팔츠 주립 필하모니(Staatilharmonie Rheinland-Pfalz)의 비대면 VR라이브 오케스트라공연(독일 공연명 : 360° 라이브 스트림)을 한국에서 원격으로 중계한다.","EC_M02_157742"
